{
  "schema_version": "v1",
  "id": "mb2-phase-65-evidence-sufficiency-report",
  "game": "magic",
  "product_id": "mystery_booster_2",
  "artifact_version": "1",
  "rule_claim_matrix_id": "mb2-phase-65-rule-claim-matrix",
  "known_claim_ids": ["mb2.rule.product.identity"],
  "partially_known_claim_ids": ["mb2.rule.card-pool.membership.partial"],
  "unknown_claim_ids": [
    "mb2.rule.collation.dependencies",
    "mb2.rule.pack.structure",
    "mb2.rule.print-sheet.entries-and-weights",
    "mb2.rule.probability.distribution",
    "mb2.rule.replacement.behavior",
    "mb2.rule.slot.definitions",
    "mb2.rule.treatment.selection"
  ],
  "canonical_rule_population_blockers": [
    "No preserved evidence defines the complete booster structure or Slot graph.",
    "No preserved evidence defines complete card-pool boundaries, Print Sheet entries, or weights.",
    "No preserved evidence defines replacement, treatment-selection, or collation semantics."
  ],
  "pack_generation_blockers": [
    "A valid pack cannot be generated without the number and purpose of its Slots.",
    "A valid pack cannot be generated without complete eligible Printing pools and selection weights.",
    "A valid pack cannot be generated without replacement and dependency semantics."
  ],
  "probability_calculation_blockers": [
    "Outcome probabilities cannot be calculated without complete Slots, pools, and weights.",
    "Joint probabilities cannot be calculated while replacement and cross-Slot collation dependencies are unknown."
  ],
  "architectural_sufficiency": {
    "relationship": "Product -> Slot -> Print Sheet -> Printing -> Card",
    "supported_evidence_status": "sufficient",
    "complete_product_status": "indeterminate",
    "limitations": [
      "The supported evidence is limited to Product identity and four partial product-membership examples; the Tier 0 relationship can represent those facts without extension.",
      "The repository has no supported evidence describing actual Slot selection or collation behavior, so fidelity for the complete Mystery Booster 2 product cannot yet be established."
    ],
    "architectural_questions": [
      "If future evidence establishes conditional, correlated, mutually exclusive, or sequenced selection events, can the current single-sheet Slot with draw_count and replacement represent them without product-specific behavior?"
    ],
    "tier_0_change_authorized": false
  }
}
